{
  "request_id": "req-123",
  "user_id": "u-42",
  "doc_id": "doc-9001",
  "page_number": 1,
  "image": "https://cdn.example.com/scans/vol1/page001.jpg",
  "content_type": "image/jpeg",
  "language_hint": ["de", "en"],
  "mode_hint": "base",
  "output_format": "json",
  "return_layout": true,
  "post_correction": true,
  "timeout_ms": 500
}

